{"catalog":"merchants","parser_version":"ws31-generator/2.0.0","patch":"1298","rows":[{"derivation":"K_NPC.iSellingGroup == ITEM.SellingGroup","items":[],"merchant_id":101000,"npc_template_ids":[22200],"verification":{"provenance":[{"commit":"bec619466938d278339c30e5b1a4bff3c9413bab","path":"ManualSetup/6_InsertData_K_NPC.sql","source_id":"openko-db"},{"commit":"bec619466938d278339c30e5b1a4bff3c9413bab","path":"ManualSetup/6_InsertData_ITEM.sql","source_id":"openko-db"}],"status":"VERIFIED"}},{"derivation":"K_NPC.iSellingGroup == ITEM.SellingGroup","items":[],"merchant_id":101001,"npc_template_ids":[22210],"verification":{"provenance":[{"commit":"bec619466938d278339c30e5b1a4bff3c9413bab","path":"ManualSetup/6_InsertData_K_NPC.sql","source_id":"openko-db"},{"commit":"bec619466938d278339c30e5b1a4bff3c9413bab","path":"ManualSetup/6_InsertData_ITEM.sql","source_id":"openko-db"}],"status":"VERIFIED"}},{"derivation":"K_NPC.iSellingGroup == ITEM.SellingGroup","items":[],"merchant_id":103002,"npc_template_ids":[22109],"verification":{"provenance":[{"commit":"bec619466938d278339c30e5b1a4bff3c9413bab","path":"ManualSetup/6_InsertData_K_NPC.sql","source_id":"openko-db"},{"commit":"bec619466938d278339c30e5b1a4bff3c9413bab","path":"ManualSetup/6_InsertData_ITEM.sql","source_id":"openko-db"}],"status":"VERIFIED"}},{"derivation":"K_NPC.iSellingGroup == ITEM.SellingGroup","items":[],"merchant_id":103072,"npc_template_ids":[22110],"verification":{"provenance":[{"commit":"bec619466938d278339c30e5b1a4bff3c9413bab","path":"ManualSetup/6_InsertData_K_NPC.sql","source_id":"openko-db"},{"commit":"bec619466938d278339c30e5b1a4bff3c9413bab","path":"ManualSetup/6_InsertData_ITEM.sql","source_id":"openko-db"}],"status":"VERIFIED"}},{"derivation":"K_NPC.iSellingGroup == ITEM.SellingGroup","items":[],"merchant_id":201000,"npc_template_ids":[504,526,12200,13004,17002,22106,27002],"verification":{"provenance":[{"commit":"bec619466938d278339c30e5b1a4bff3c9413bab","path":"ManualSetup/6_InsertData_K_NPC.sql","source_id":"openko-db"},{"commit":"bec619466938d278339c30e5b1a4bff3c9413bab","path":"ManualSetup/6_InsertData_ITEM.sql","source_id":"openko-db"}],"status":"VERIFIED"}},{"derivation":"K_NPC.iSellingGroup == ITEM.SellingGroup","items":[],"merchant_id":201001,"npc_template_ids":[12202,13008],"verification":{"provenance":[{"commit":"bec619466938d278339c30e5b1a4bff3c9413bab","path":"ManualSetup/6_InsertData_K_NPC.sql","source_id":"openko-db"},{"commit":"bec619466938d278339c30e5b1a4bff3c9413bab","path":"ManualSetup/6_InsertData_ITEM.sql","source_id":"openko-db"}],"status":"VERIFIED"}},{"derivation":"K_NPC.iSellingGroup == ITEM.SellingGroup","items":[],"merchant_id":202000,"npc_template_ids":[503,525,12100,12102,13002,17003,22100,27003],"verification":{"provenance":[{"commit":"bec619466938d278339c30e5b1a4bff3c9413bab","path":"ManualSetup/6_InsertData_K_NPC.sql","source_id":"openko-db"},{"commit":"bec619466938d278339c30e5b1a4bff3c9413bab","path":"ManualSetup/6_InsertData_ITEM.sql","source_id":"openko-db"}],"status":"VERIFIED"}},{"derivation":"K_NPC.iSellingGroup == ITEM.SellingGroup","items":[],"merchant_id":202001,"npc_template_ids":[12203,13006,22203],"verification":{"provenance":[{"commit":"bec619466938d278339c30e5b1a4bff3c9413bab","path":"ManualSetup/6_InsertData_K_NPC.sql","source_id":"openko-db"},{"commit":"bec619466938d278339c30e5b1a4bff3c9413bab","path":"ManualSetup/6_InsertData_ITEM.sql","source_id":"openko-db"}],"status":"VERIFIED"}},{"derivation":"K_NPC.iSellingGroup == ITEM.SellingGroup","items":[],"merchant_id":203002,"npc_template_ids":[12121,13001],"verification":{"provenance":[{"commit":"bec619466938d278339c30e5b1a4bff3c9413bab","path":"ManualSetup/6_InsertData_K_NPC.sql","source_id":"openko-db"},{"commit":"bec619466938d278339c30e5b1a4bff3c9413bab","path":"ManualSetup/6_InsertData_ITEM.sql","source_id":"openko-db"}],"status":"VERIFIED"}},{"derivation":"K_NPC.iSellingGroup == ITEM.SellingGroup","items":[],"merchant_id":203072,"npc_template_ids":[12122],"verification":{"provenance":[{"commit":"bec619466938d278339c30e5b1a4bff3c9413bab","path":"ManualSetup/6_InsertData_K_NPC.sql","source_id":"openko-db"},{"commit":"bec619466938d278339c30e5b1a4bff3c9413bab","path":"ManualSetup/6_InsertData_ITEM.sql","source_id":"openko-db"}],"status":"VERIFIED"}},{"derivation":"K_NPC.iSellingGroup == ITEM.SellingGroup","items":[],"merchant_id":231000,"npc_template_ids":[14401,14402,14403,14415,14416,18003],"verification":{"provenance":[{"commit":"bec619466938d278339c30e5b1a4bff3c9413bab","path":"ManualSetup/6_InsertData_K_NPC.sql","source_id":"openko-db"},{"commit":"bec619466938d278339c30e5b1a4bff3c9413bab","path":"ManualSetup/6_InsertData_ITEM.sql","source_id":"openko-db"}],"status":"VERIFIED"}},{"derivation":"K_NPC.iSellingGroup == ITEM.SellingGroup","items":[],"merchant_id":251000,"npc_template_ids":[501,523],"verification":{"provenance":[{"commit":"bec619466938d278339c30e5b1a4bff3c9413bab","path":"ManualSetup/6_InsertData_K_NPC.sql","source_id":"openko-db"},{"commit":"bec619466938d278339c30e5b1a4bff3c9413bab","path":"ManualSetup/6_InsertData_ITEM.sql","source_id":"openko-db"}],"status":"VERIFIED"}},{"derivation":"K_NPC.iSellingGroup == ITEM.SellingGroup","items":[],"merchant_id":252000,"npc_template_ids":[522],"verification":{"provenance":[{"commit":"bec619466938d278339c30e5b1a4bff3c9413bab","path":"ManualSetup/6_InsertData_K_NPC.sql","source_id":"openko-db"},{"commit":"bec619466938d278339c30e5b1a4bff3c9413bab","path":"ManualSetup/6_InsertData_ITEM.sql","source_id":"openko-db"}],"status":"VERIFIED"}},{"derivation":"K_NPC.iSellingGroup == ITEM.SellingGroup","items":[],"merchant_id":253000,"npc_template_ids":[506,528,12117,12118,13003,13005,16089,17005,22202,27005],"verification":{"provenance":[{"commit":"bec619466938d278339c30e5b1a4bff3c9413bab","path":"ManualSetup/6_InsertData_K_NPC.sql","source_id":"openko-db"},{"commit":"bec619466938d278339c30e5b1a4bff3c9413bab","path":"ManualSetup/6_InsertData_ITEM.sql","source_id":"openko-db"}],"status":"VERIFIED"}},{"derivation":"K_NPC.iSellingGroup == ITEM.SellingGroup","items":[],"merchant_id":254000,"npc_template_ids":[7002,12301,22301],"verification":{"provenance":[{"commit":"bec619466938d278339c30e5b1a4bff3c9413bab","path":"ManualSetup/6_InsertData_K_NPC.sql","source_id":"openko-db"},{"commit":"bec619466938d278339c30e5b1a4bff3c9413bab","path":"ManualSetup/6_InsertData_ITEM.sql","source_id":"openko-db"}],"status":"VERIFIED"}},{"derivation":"K_NPC.iSellingGroup == ITEM.SellingGroup","items":[],"merchant_id":255000,"npc_template_ids":[505,527,11045,12120,12208,13007,16062,17004,18001,21047,22120,22208,26062,27004],"verification":{"provenance":[{"commit":"bec619466938d278339c30e5b1a4bff3c9413bab","path":"ManualSetup/6_InsertData_K_NPC.sql","source_id":"openko-db"},{"commit":"bec619466938d278339c30e5b1a4bff3c9413bab","path":"ManualSetup/6_InsertData_ITEM.sql","source_id":"openko-db"}],"status":"VERIFIED"}}],"source_commits":{"openko-client-1298":"b4636332c7cd818b0ce171eccc973dd3d6b2e56d","openko-db":"bec619466938d278339c30e5b1a4bff3c9413bab","openko-server":"7d6cf81093e142c928c2ac9510512b2b182178b5"}}
